1699100934-235,"Vacation ❘ FamilyThe hotel has a great location, to transport, to everything. The room was clean and the concierge staff were very polite and helpful. The view from our room was excellent. … Read moreThe hotel has a great location, to transport, to everything. The room was clean and the concierge staff were very polite and helpful. The view from our room was excellent.
Mattresses need replacement, my back was not handling sinking in the middle, I am not going to blame the staff for this as I didn’t complain I was too busy trying to enjoy every hour in London.
I would stay there again, making sure I get a comfortable bed.Rooms3.0Service4.0Location5.0Hotel highlightsGreat view · QuietReport reviewResponse from the owner3 weeks agoThank you for your Kind feedback.  We look forward in welcoming you back to our hotel. Kindest Regards, Soumya Nandi  Guest Services Executive The Tower Hotel",4
1699100934-236,"Beautiful  hotel, beds were so comfortable  especially  the pillows. We had a great view of the river  especial at night. fantastic buffet breakfast. Great location.staff especially  the concierge  were so helpful.  They gave us advice and … Read moreBeautiful  hotel, beds were so comfortable  especially  the pillows. We had a great view of the river  especial at night. fantastic buffet breakfast. Great location.staff especially  the concierge  were so helpful.  They gave us advice and a map on how to get to our destinations.  If planning  a late check out , then ask at time of booking as they are so busy the rooms are fully booked and you will not be able to get it. Over all I would definitely  recommend  this hotel.Report reviewResponse from the owner2 months agoDear SorchaThank you very much for staying with us at The The Tower Hotel and taking the time to write an amazing review of your stay. Please know that I have passed all of your comments to our team and we hope we can welcome you back very soon. Kindest Regards,Fabrizio GiacovazziGuest Services ExecutiveThe Tower Hotel",4
1699100934-237,"Vacation ❘ CoupleGreat hotel for a good holidays in London.
Excellent location from which to walk along the riverside to the city centre or … Read moreGreat hotel for a good holidays in London.
Excellent location from which to walk along the riverside to the city centre or enjoy a night out in The City. Tower Hill tube is an 8 minute walk from the hotel.
The hotel service was excellent and friendly at all times, the cleanliness of the rooms was very good and the receptionists charming. We would have liked the dining room staff to control the rude people more and avoid disturbing other guests.
The breakfast was always well prepared, although regarding the variety of sweet, fruits and savoury dishes, it was almost the same everyday. But overall everything was good and very tasty.
If we return to London, we will definitely consider this hotel, as we found it lovely, good located, good service and the atmosphere in the surrounding area is ideal.
Thank you very much.Rooms5.0Service5.0Location5.0Hotel highlightsGreat view · Romantic · Great valueReport reviewResponse from the owner2 months agoDear Christian A BThank you so much for your raving review about your stay with us at The The Tower Hotel! It means a great deal to us to hear about your experience.We hope to have the opportunity of welcoming you back again soon.Kind regardsFabrizio GiacovazziGuest Services ExecutiveThe Tower Hotel",5
1699100934-238,"Vacation ❘ CoupleEin Hotel das in die Jahre gekommen ist. Man sieht ihm an, es war Mal ganz große Klasse. Allerdings hat man die vergangenen Jahre nicht mehr viel Geld in die Instandhaltung gesteckt. Der Chrom von den Badezimmer Armaturen ist teilweise … Read moreEin Hotel das in die Jahre gekommen ist. Man sieht ihm an, es war Mal ganz große Klasse. Allerdings hat man die vergangenen Jahre nicht mehr viel Geld in die Instandhaltung gesteckt. Der Chrom von den Badezimmer Armaturen ist teilweise weggeputzt, die Badewanne ist zerkratzt, dass Holz an den Türen verschlissen. Aber es ist alles sehr sauber, das Personal ist sehr freundlich und das Frühstück ist gut. Wir haben uns wohl gefühlt.
(Translated by Google)
A hotel that is getting old. You can tell it was really great. However, not much money has been put into maintenance in recent years. The chrome from the bathroom fittings is partly cleaned away, the bathtub is scratched and the wood on the doors is worn. But everything is very clean, the staff is very friendly and the breakfast is good. We felt good.Rooms4.0Service5.0Location5.0Hotel highlightsGreat viewReport reviewResponse from the ownera week agoThank you for your Kind feedback.  We look forward in welcoming you back to our hotel. Kindest Regards, Soumya Nandi  Guest Services Executive The Tower Hotel",4
1699100934-239,"BusinessStaff are amazing so attentive, rooms are small but totally fine for what I needed and the view of tower bridge and the Thames are amazing, bed was super comfy and breakfast was delicious with lots of choice either hot or cold. It's … Read moreStaff are amazing so attentive, rooms are small but totally fine for what I needed and the view of tower bridge and the Thames are amazing, bed was super comfy and breakfast was delicious with lots of choice either hot or cold. It's definitely the people that make the experience though so 5 stars to all the staff. Lifts can get busy with 12 floors to cater for so maybe just allow a bit of time for that.Rooms4.0Service5.0Location5.0Hotel highlightsGreat viewReport reviewResponse from the ownera month agoThank you for your Kind feedback.  We look forward in welcoming you back to our hotel. Kindest Regards, Soumya Nandi  Guest Services Executive The Tower Hotel",5
1699100934-240,"CoupleWe stayed here for our honeymoon. They graciously upgraded us to a larger room with a beautiful view of the Tower Bridge. So kind of them, and much appreciated! … Read moreWe stayed here for our honeymoon. They graciously upgraded us to a larger room with a beautiful view of the Tower Bridge. So kind of them, and much appreciated!
The property and room was nice. Busy area with major sights just a stones throw away. Train station also closeby to see other sights further away.
Nothing bad to say about this hotel, happy we stayed there and would recommend to others.Rooms4.0Service4.0Location4.0Hotel highlightsGreat view · Great valueRoomsRoom was clean. Bed was comfortable.Nearby activitiesLots of restaurants closeby. Tower of London, Tower Bridge, and St Katherines Docks just a short walk away.SafetyFelt safe walking around the neighborhood. No safety concerns inside the hotel.WalkabilityTrain station closeby. Lots of restaurants closeby. Tower of London and Tower Bridge just a short walk away. Densely populated pedestrian area.Report reviewResponse from the owner3 weeks ago Thank you for your Kind feedback.  We look forward in welcoming you back to our hotel. Kindest Regards, Soumya Nandi  Guest Services Executive The Tower Hotel",4
1699100938-241,"Vacation ❘ CoupleWe had an excellent time at the Royal Horseguards Hotel.
The rooms are well appointed but on the small side, it is an older style building with a historical past that new builds can't offer. … Read moreWe had an excellent time at the Royal Horseguards Hotel.
The rooms are well appointed but on the small side, it is an older style building with a historical past that new builds can't offer.
For breakfast there was an excellent array of food with little wanting.  Staff were very attentive and sometimes too eager to take your plate.
It's walking distance to many great tourist attractions,
Big Ben
Parliament House
London Eye
Westminster Abbey
Nelson's column
And even New Scotland Yard
Etc etc.
A short two minute walk to the Hop on Hop off bus.
Loads of cafe's, restaurants the tube and various shops.
When we're back in London we will certainly stay here again.Rooms5.0Service5.0Location5.0Hotel highlightsLuxuryReport review+7Response from the owner3 days agoDear Lindsay Oehm, Thank you so much for your feedback regarding your recent stay with us at The Royal Horseguards Hotel. We always strive to deliver the best experience to our guests and I am delighted to hear that you had an enjoyable stay with us and made use of our incredible location. We look forward to your next stay. Kind regards, Szymon Kogut Guest Services Executive",5
1699100938-242,"Vacation ❘ CoupleEverything one might want to see in London is easily within walking distance from the hotel. Not a walker, no problem, busses, the tube, and taxis are close by for those who need it. Staff is courteous and the English breakfast is great. I would definitely stay again.Rooms5.0Service5.0Location5.0Hotel highlightsGreat view · Romantic · QuietReport reviewResponse from the owner3 weeks agoDear David, Thank you so much for your feedback regarding your recent stay with us at The Royal Horseguards Hotel. We always strive to deliver the best experience to our guests and I am delighted to hear that you had an enjoyable stay with us. Our guest's valued comments, based on their experience, assist us in continually improving our service standards. I am delighted to hear that all team members involved were able to contribute to the smoothness of your stay with us. We look forward to welcoming you back on your next trip to our wonderful city. Kind Regards Szymon Kogut Concierge & Guest Services Executive",5
1699100938-243,"Just stayed here for a week for my honeymoon and enjoyed every second! Location is amazing for sightseeing and is a few minutes walk from the Embankment tube station that can take you anywhere else! The room was clean and well appointed, … Read moreJust stayed here for a week for my honeymoon and enjoyed every second! Location is amazing for sightseeing and is a few minutes walk from the Embankment tube station that can take you anywhere else! The room was clean and well appointed, bed was comfy, AC was cold and the shower was hot! The heated floors and heated towel rack were a nice addition to the bathroom. We also ordered room service for breakfast and dinner and both were delicious! I have zero complaints and would happily stay again!Rooms5.0Service5.0Location5.0Hotel highlightsLuxury · Great view · QuietReport reviewResponse from the ownera month agoDear Michelle, Thank you for taking the time to review your recent stay with us. I am delighted to hear that all team members involved were able to contribute to the smoothness of your stay with us and that you enjoyed our stunning location. We look forward to welcoming you soon. Kind regards, John Guest Services Executive",5
1699100938-244,"We had this hotel booked through Costco Travel and it exceeded our expectations from  the start.  Luxurious hotel, full of rich history, great location near Trafalgar Square, the River Thames, London Eye and lots of other site-seeing … Read moreWe had this hotel booked through Costco Travel and it exceeded our expectations from  the start.  Luxurious hotel, full of rich history, great location near Trafalgar Square, the River Thames, London Eye and lots of other site-seeing locations if you are able to walk.  Just around the corner from pubs, restaurants and souvenir shops, on the bus line as well.  The front desk staff that greeted us were very professional and helpful as was a young concierge we quickly became attached to named ""Roberts"" who was so helpful to us with directions, phone difficulties we were having with a travel plan, and he gave us a private tour of the whole hotel with its rich, impressive history! He knew so much about the hotel.  Roberts helped us with our luggage, hailing a cab and getting us acclimated to London overall.  It was our first stop in a 17 day journey through England and Ireland.  The lobby and hallways were so neat and clean and the daily breakfast was so fresh, tasty, filling and enjoyable.  You could order off the menu or choose to eat from the varieties of foods, pastries, fruit, meats and cheeses, yogurts and cereal on display in the buffet room.  While we are NOT gluten-free, they had much to choose from if you needed GF choices.  Beautiful and classy hotel, terrific food and beverages and a top notch location all rolled into one! We so enjoyed our stay.Rooms5.0Service5.0Location5.0Report reviewResponse from the owner3 weeks agoDear Mary Beth,Thank you so much for your feedback regarding your recent stay with us at The Royal Horseguards Hotel.We always strive to deliver the best experience to our guests and I am delighted to hear that you had an enjoyable stay with us, I am delighted to hear that all team members involved were able to contribute to the smoothness of your stay with us. We look forward to welcoming you back on your next trip to our wonderful city. Kind RegardsBurak IpekciHead Concierge & Guest Services Manager",5
1699100938-245,"Vacation ❘ CoupleBought a Groupon voucher for 3 course dining, with a bottle of wine. Had a minor issue booking in but it got sorted. The food was superb, staff were very attentive and interesting. Great experience and a beautiful hotel. Couldn’t afford to stay there unfortunately. …Read moreFood & drinksSuperb - both in taste and presentation.Report reviewResponse from the ownera week agoDear Andrea, Thank you so much for your feedback regarding your recent visit to The Royal Horseguards Hotel. We always strive to deliver the best experience to our guests and I am delighted to hear that you had a wonderful dining experience with us. Our guest's valued comments, based on their experience, assist us in continually improving our service standards. I am delighted to hear that all team members involved were able to contribute to the smoothness of your service. We look forward to welcoming you back on your next visit to our wonderful restaurant. Kind Regards, John Yariga Concierge & Guest Services Executive",5
1699100938-246,"I was considering staying here when I had a day to spend in London, walked into the lobby and thought: no thank you. The pictures look stunning but the reality is quite different…. I mean the reception staff were insanely rude when … Read moreI was considering staying here when I had a day to spend in London, walked into the lobby and thought: no thank you. The pictures look stunning but the reality is quite different…. I mean the reception staff were insanely rude when responding to my questions about the rate and availability, looking down at me and made me wait for a while. The reception was empty when I came in. Not a 5 star service. I simply didn’t want to pay 370£  for this treatment and also… please fix the ceiling leak in the dining room:)Rooms1.0Service1.0Location1.0Report reviewResponse from the ownera month agoDear Elizaveta, I am deeply saddened to hear that our team members involved were not able to extend to you to the full display of our hotel's hospitality and contribute smoothness of your stay with us . I have shared your observations with the relevant department heads for an internal follow-up. We hope to get the opportunity to welcome you soon. Kind regards, John Yariga Guest Services Executive",1
1699100938-247,"Vacation ❘ CoupleIncredible staff, hotel, and location. My husband and I were celebrating our 10 year wedding anniversary. The staff made every moment during our stay so special. Farouq is the concierge we have had the pleasure of working with, the … Read moreIncredible staff, hotel, and location. My husband and I were celebrating our 10 year wedding anniversary. The staff made every moment during our stay so special. Farouq is the concierge we have had the pleasure of working with, the restaurant he selected for anniversary night was stunning with views of the London Bridge.
You must stop at the bar and see Valentin, he makes the best cocktails. His attention to detail and remembering your drink of choice is remarkable. My New England Patriots friend for life!Rooms5.0Service5.0Location5.0Hotel highlightsLuxury · Great view · Romantic · QuietReport review+3Response from the ownera month agoDear Geneva, On behalf of Faroq and my entire team, I am incredibly grateful for such a warm review. We look forward to welcoming you back soon. Kind regards, John Yariga Guest Services Executive",5
1699100938-248,"Incredible service and lovely location. I felt extremely welcomed by the front desk workers, as well as the hostess during breakfast and the High Tea (Olana, I believe is her name - such a wonderful person!). The breakfast was outstanding … Read moreIncredible service and lovely location. I felt extremely welcomed by the front desk workers, as well as the hostess during breakfast and the High Tea (Olana, I believe is her name - such a wonderful person!). The breakfast was outstanding and the location is superb. My only area's of feedback is that the hotel rooms could be updated slightly, with more refreshments provided (they are a bit sparse in the fridge). Other than that, lovely hotel and I would HIGHLY recommend it! 10/10.Rooms4.0Service5.0Location5.0Report reviewResponse from the owner2 months agoDear Rachel Maize,Thank you for taking the time to share your wonderful review.We are delighted to read that you have enjoyed our unbeatable location and that our team was successful in creating the ""home away from home"" feeling.We are looking forward to welcoming you back soon.JohnGuest Services Executive",5
1699100938-249,"A wonderful 5 night stay in central London. Beautiful hotel fitting for a special visit to London. Lovely quiet room beautiful breakfast buffet and the afternoon tea a delight. Lovely garden setting out the front of the hotel with a bar for cocktails and food. A memorable visit I shall treasure. DRooms5.0Service5.0Location5.0Report review+8Response from the owner2 months agoDear James,Thank you for taking the time to review your recent stay with us.Delighted to read that you enjoyed our heritage Victorian building.We hope to welcome you back soon!Kind regards,JohnGuest Services Executive",5
1699100938-250,"Vacation ❘ FriendsWe went for afternoon tea. The staff were brilliant from the door staff to the wait staff. Of particular note was Olena. She took amazing care  of us. We were celebrating my friend who got married. She came over with cheesecake with … Read moreWe went for afternoon tea. The staff were brilliant from the door staff to the wait staff. Of particular note was Olena. She took amazing care  of us. We were celebrating my friend who got married. She came over with cheesecake with ""congratulations"" written in chocolate. This was unexpected but very thoughtful. The food was well presented and flavourful. All in all it was a truly exceptional experience. I wholeheartedly recommend.Service5.0Location5.0Hotel highlightsLuxury · RomanticNoteworthy detailsOlenaReport reviewResponse from the ownera month agoDear Audrey,On behalf of Olena and the Hotel, we thank you for your warm words and the wonderful review. We hope to get the opportunity to welcome you again soon. Kind regards,JohnGuest Services Executive",5
1699100943-251,"Business ❘ SoloHotel was very clean and well laid out. Room was spacious and comfortable. Breakfast had a good selection and regularly topped up with fresh food. Fresh fruit salad was a personal favourite and nice to see. … Read moreHotel was very clean and well laid out. Room was spacious and comfortable. Breakfast had a good selection and regularly topped up with fresh food. Fresh fruit salad was a personal favourite and nice to see.
Staff were all friendly and helpful. Only criticism i could make, were the key cards were a little temperamental, but that could easily have been user error on my part.
I would definitely stay again and can say i enjoyed my trip.RoomsRoom was a good size, toilet was in a wet room design and bed was comfortable.Nearby activitiesI think it is the closest hotel to Wembley Stadium, was only a ~200m walk to get in.Food & drinksBreakfast was self service, but the food was constantly monitored and replenished as needed. Filled my tummy in the morning, so i was happy.Report review",5
1699100943-252,"Vacation ❘ CoupleWe stayed one night as we were seeing Ricky Gervais on the evening. Super quick check in and out, the room was spacious and the bed was super comfortable. Bathroom was simple but got the job done. Breakfast was fantastic, we got our money's … Read moreWe stayed one night as we were seeing Ricky Gervais on the evening. Super quick check in and out, the room was spacious and the bed was super comfortable. Bathroom was simple but got the job done. Breakfast was fantastic, we got our money's worth lol. Would definitely stay here again! Easy to get to using the tube. May be a little far out for central London, but good for a short and cheap stay :)Rooms5.0Service5.0Location5.0Hotel highlightsQuiet · Great valueReport review",5
1699100943-253,"Vacation ❘ FriendsHad been contacted at work on the day of the visit to ask if I could swap for a double. Needed a twin and there were none available so asked why and was told the room was an accessibility suite due for maintenance work, but was not … Read moreHad been contacted at work on the day of the visit to ask if I could swap for a double. Needed a twin and there were none available so asked why and was told the room was an accessibility suite due for maintenance work, but was not specified what the works were. Staff were friendly when we arrived but were unable to advise what the problems were. My friend and I arrived back to the room after a show and after spending some time at the Ibis bar headed to bed. The beds were fine and comfortable
and at that stage only noticed one plug socket not working. Found the real problem in the morning when the shower flooded the bathroom making it unusable. Would have been a bigger issue if we were staying for more than a night but did marr an otherwise good experience.Rooms1.0Service5.0Location5.0Report review",2
1699100943-254,"Business ❘ SoloStayed a few times at the Ibis Wembley and I must say, it was a wonderful experience. … Read moreStayed a few times at the Ibis Wembley and I must say, it was a wonderful experience.
The location of this hotel is the main catch. Situated in the heart of Wembley, it extends easy access to a good few attractions along with Cafes, Restaurants & shopping malls. Wembley Stadium is just around the corner.
Transportation is another benefit here with access to multiple options at the doorstep. The rooms were clean & hygienic. The price was reasonable with amenities. The staff at Ibis Wembley were always helpful and on top of everything.
Anyone looking for a delightful experience in London, this hotel should be on your list.Rooms5.0Service5.0Location5.0Hotel highlightsGreat view · Great valueReport review",5
1699100943-255,"Vacation ❘ FriendsWell located to the Wembley Arena, where we were attending the function.  Also closely located to the outlet stores.  Staff were pleasant and room was clean.  We were on the 14th floor and there was work being done in the staff lift area. … Read moreWell located to the Wembley Arena, where we were attending the function.  Also closely located to the outlet stores.  Staff were pleasant and room was clean.  We were on the 14th floor and there was work being done in the staff lift area.  Would have appreciated warning that work would commence early in the morning.  We had a late night and were sleeping in.  The cleaner knocked but I didn't get time to response before they opened the door.  However, they did shut the door as soon as I responded when they opened the door.Rooms3.0Service3.0Location4.0Hotel highlightsGreat viewReport review",3
1699100943-256,"Vacation ❘ FriendsVisited for Wembley match. The location is absolutely fantastic. Close to wembley and tube. Staff were super friendly and helpful. … Read moreVisited for Wembley match. The location is absolutely fantastic. Close to wembley and tube. Staff were super friendly and helpful.
Rooms were good size and liked the funky curved bathrooms. Would definitely recommend!Rooms5.0Service5.0Location5.0Hotel highlightsKid-friendly · Great valueReport review",5
1699100943-257,"Vacation ❘ FamilyPretty small & cramped family room, hardly any space to move around. Bathroom is just big enough for one person to stand. Chose it due to its location within Wembley which is a nice area.Rooms2.0Service3.0Location4.0Hotel highlightsGreat viewReport review",3
1699100943-258,"Vacation ❘ FamilyGreat place! Me and my mother visited London for a concert in the OVO arena, Wembley. The hotel is in very close proximity to both the arena and the Wembley stadium. Customer service was amazing. The people at the front desk were super nice … Read moreGreat place! Me and my mother visited London for a concert in the OVO arena, Wembley. The hotel is in very close proximity to both the arena and the Wembley stadium. Customer service was amazing. The people at the front desk were super nice and accommodating. They even provided us with adapters free of charge since our chargers didn't fit the ports and also helped us order a taxi.Rooms4.0Service5.0Location5.0Report review",5
1699100943-259,"Vacation ❘ FamilyStayed for two nights. Reasonably priced by London standards, good location next to Wembley Stadium. Rooms were comfortable and spacious. Good choice of food at breakfast.Rooms5.0Service5.0Location5.0Hotel highlightsGreat valueReport review",5
