1699100846-131,"Vacation ❘ CoupleA truly fantastic stay at this beautiful, well located hotel. We spent 2 nights here this week, celebrating our wedding anniversary. The welcome was professional and warm. The room was a great size but the views were just incredible. We … Read moreA truly fantastic stay at this beautiful, well located hotel. We spent 2 nights here this week, celebrating our wedding anniversary. The welcome was professional and warm. The room was a great size but the views were just incredible. We stayed in 2101 and the views watching the sun rise and sun set over London were wonderful. Drinks prices in the onsite restaurant were steep, but as expected in this kind of establishment. The breakfast was delicious and service very prompt. However our favourite part was the pool and gym. We went both days we were there and were lucky enough to be the only ones using it both times. I have nothing negative to say, it was a perfect way to spend a few nights away relaxing and celebrating.Rooms5.0Service5.0Location5.0Hotel highlightsLuxury · Great view · Romantic · QuietWalkabilityWell connected with 3 TFL lines all within 10 minutes. All of the major restaurants and facilities of Canary Wharf within 10 minute walk.Report review+10Response from the owner3 months agoThank you so much Tom Smith for this fantastic feedback. We are so happy to hear that you had such a fantastic stay with us and we hope to see you again soon! -  Anna & The Novotel London Canary Wharf Family",5
1699100846-132,"Vacation ❘ CoupleI'd say this stay was average compared to other stays. The price is not in line with the quality of the hotel. Firstly there are 4 lifts but there is always a long wait. When checking out, our lift stopped on 10 floors without being able to … Read moreI'd say this stay was average compared to other stays. The price is not in line with the quality of the hotel. Firstly there are 4 lifts but there is always a long wait. When checking out, our lift stopped on 10 floors without being able to take any further people on it. It was frustrating! The room itself was okay, there were stains on the floor and the sink. The AC was not cool at all. On a lighter note, the view was beautiful and the bar on floor 38 and 39 had even more amazing views. But it was not worth the money unfortunately. We stayed at a cheaper hotel the night before and felt that was better.Rooms2.0Service5.0Location4.0Hotel highlightsGreat viewReport reviewResponse from the owner4 weeks agoThank you for taking the time to share your feedback about your recent stay with us Ashee R. We genuinely appreciate your input, as it helps us identify areas where we can improve our services.We apologise for the inconvenience you experienced during your stay, particularly with the long wait times for the elevators. We understand that this can be frustrating, and we are actively looking into ways to improve elevator efficiency to provide a smoother experience for our guests.Additionally, we regret to hear about the cleanliness issues you encountered in your room, such as stains on the floor and sink. We will address this with our housekeeping team to ensure such oversights are rectified promptly. Your comfort and satisfaction are important to us, and we will use your feedback to make necessary improvements.We are pleased to hear that you enjoyed the beautiful views from our bar on floors 38 and 39. However, we are disappointed that you did not find the overall value of your stay to be in line with the price. We continuously strive to offer the best experience for our guests, and we will take your comments into account as we work to enhance our offerings.We hope you will consider giving us another opportunity to provide you with a more satisfactory stay in the future. We value your feedback, and it is essential for us to continue improving our services.Thank you for choosing to stay with us, and we hope to have the chance to welcome you back soon m- Anna & The Novotel London Canary Wharf Family",3
1699100846-133,"Vacation ❘ CoupleMy boyfriend booked this hotel for my 21st birthday. We had an amazing view of central London. The room was so nice. The bed was comfortable and lots of space. The TV was massive but you are more focused on the view than the TV. We got cans … Read moreMy boyfriend booked this hotel for my 21st birthday. We had an amazing view of central London. The room was so nice. The bed was comfortable and lots of space. The TV was massive but you are more focused on the view than the TV. We got cans of water and biscuits in the room. The staff were friendly. We went to the bar on the 38th floor which was beautiful. The views 10/10. Prices of the drinks are expensive but that’s what you pay for a view as amazing as that. Would definitely go back there for a special occasion only. Great experience and a lovely hotel.Rooms5.0Service5.0Location5.0Hotel highlightsLuxury · Great view · Great valueReport review+2Response from the ownera month agoWe're delighted to hear that you had a memorable 21st birthday celebration at our hotel  Fyn Simmonds ! It's wonderful to know that you enjoyed the amazing view of central London from your room, the comfortable accommodations, and the thoughtful amenities. Our team is pleased that you found them friendly and accommodating.The bar on the 38th floor does indeed offer breathtaking views, and we understand that special occasions call for something extraordinary. Thank you for choosing us to be a part of your celebration, and we look forward to welcoming you back for another special occasion in the future- Anna & The Novotel London Canary Wharf Family",5
1699100846-134,Vacation ❘ SoloThe staff were so lovely. I booked for my birthday stay and they tried to sort an alternative for me as soon as possible as there were problems with my restaurant. No problems with the stay. Great view and great facilities. Very clean hotel also. Would recommend!Rooms5.0Service5.0Location5.0Hotel highlightsLuxury · Great view · Romantic · QuietReport reviewResponse from the owner2 weeks agoThank you Nadia O for sharing your feedback in regards to your stay. We're thrilled to read that we made your birthday celebration s memorable! - Anna & The Novotel London Canary Wharf Family,5
1699100846-135,"Good stay, upgraded to a room with a h beautiful view on 32nd floor. Great drinks in the bar on the top floor. Room had a few small defects and stains, and check-in took a long time.Rooms4.0Service4.0Location5.0Report review",4
1699100846-136,"Great location and quiet rooms. AC could not be turned down or even switched off completely. Got a cold and a very sore throat after only a couple nights. Rooms are tidied up nicely, but show noticeable signs of wear. Some amenities, such … Read moreGreat location and quiet rooms. AC could not be turned down or even switched off completely. Got a cold and a very sore throat after only a couple nights. Rooms are tidied up nicely, but show noticeable signs of wear. Some amenities, such as bath robes are only available at an additional price, which is not the case for other similarly priced hotels in the vicinity. Breakfast options are limited and expensive for the quality. I would go for the Hilton.Rooms4.0Service3.0Location5.0Report reviewResponse from the ownera month agoThank you Ivan Gerov for taking the time to provide us with your feedback regarding your recent stay at our hotel. We appreciate your comments and are pleased to hear that you found our location convenient and enjoyed the quiet atmosphere in our rooms.We are truly sorry to hear about the issues you encountered during your stay. Your comfort and well-being are of utmost importance to us, and we apologize for any inconvenience caused by the inability to adjust the AC to your preference. We have taken note of your feedback and will work to improve this aspect to ensure a more comfortable environment for our guests in the future.We also appreciate your feedback about the condition of the rooms and the availability of certain amenities. Our team continuously strives to maintain the highest standards, and we will address the signs of wear and consider providing additional amenities for our guests' convenience. We hope to welcoming you again in the future - Anna & The Novotel London Canary Wharf Family",3
1699100846-137,"Vacation ❘ FriendsStayed here for one night, the female staff with blonde hair(looks like Penny from the Big bomb) was very unprofessional. She told us to wait for our room key after checking in, then she completely forgot this matter. We had to wait for … Read moreStayed here for one night, the female staff with blonde hair(looks like Penny from the Big bomb) was very unprofessional. She told us to wait for our room key after checking in, then she completely forgot this matter. We had to wait for half an hour to get the room key. Ironically, we never received an apologize from this rude lady. She should be trained more properly on manners and how to use her brain.
FYI: I don’t think constructive criticism is effective as I already saw many negative reviews. TRAIN YOUR STAFFS!Report reviewResponse from the owner2 weeks agoWe appreciate you taking the time to provide feedback regarding your recent stay at our hotel Kiera W. Guest feedback is invaluable to us, as it allows us to continuously improve our services. We apologise that you didn't have the perfect check in experience however, we would like to address the language used to describe our team member.While we understand that you had a less-than-ideal experience during your check-in process, we would like to emphasise the importance of respectful and constructive feedback. We strive to maintain a positive and supportive environment for our staff, and we believe that constructive criticism is more effective in helping us make improvements. Our staff is dedicated to providing exceptional service, and we are confident that your comments will help us in our ongoing efforts to enhance the guest experience - Anna & The Novotel London Canary Wharf Family",1
1699100846-138,"Vacation ❘ FamilyI have stayed in the hotel in June for my sisters birthday and honestly must say it was absolutely amazing! We both had a lot of fun in the hotel itself and in the surrounding areas. I stayed in one of the privilege rooms which is … Read moreI have stayed in the hotel in June for my sisters birthday and honestly must say it was absolutely amazing! We both had a lot of fun in the hotel itself and in the surrounding areas. I stayed in one of the privilege rooms which is absolutely worth it, the views were incredible, the bedroom very spacious and the bathroom just wow! From the beginning of the stay we were welcomed by reception with a lovely small gesture which was a Birthday card and Chocolates which my 8 year old sister loved, the absolutely heartwarming welcome continued during the afternoon where we went to the rooftop bar/restaurant, Tevin (the employee) could not have been more accommodating! In the morning once again we were welcomed with open arms by Rebeka and Alina who were again absolutely brilliant! Breakfast was fenomenal and lots of options, plus the great views!!!! Thank you team and hope to stay with you again in the future ❤️Rooms5.0Service5.0Location5.0Hotel highlightsGreat view · Romantic · Quiet · Kid-friendly · Great valueReport reviewResponse from the owner3 months agoThank you  Wiktoria Badowska for this amazigng review! It's great to hear that you had a fantastic stay celebrating your sister's birthday and the whole team made it special. We hope to see you again soon! - Anna & The Novotel London Canary Wharf Family",5
1699100846-139,"Vacation ❘ CoupleI had an amazing birthday break at this hotel, the view from the top was just spectacular day or night, I left my car in Westferry circus for 24hrs at a cost of £18 which I thought was very reasonable and just a short walk from the hotel. Breakfast was plentiful and I'd love to go back one day as I didn't have time to try out the pool.Rooms5.0Service4.0Location5.0Hotel highlightsGreat view · RomanticReport reviewResponse from the ownera month agoThank you Angela L. for sharing this great review! We are glad you enjoyed your stay and we hope to see you again soon - Anna & The Novotel London Canary Wharf",5
1699100846-140,"Vacation ❘ CoupleIt was my first time visiting London,  and I was very happy to stay here.
The location  is good for what I paid, easy access to public transportatio (fery or underground) … Read moreIt was my first time visiting London,  and I was very happy to stay here.
The location  is good for what I paid, easy access to public transportatio (fery or underground)
Close to shopping and restaurants area.
The restaurants and bar have an amazing view of the London center.
The room is comfortable.
They have a sauna and pool, but I had no time to try it.
The breakfast is very good .Rooms5.0Service5.0Location5.0Hotel highlightsGreat view · Great valueRoomsComfortable and big enoughWalkabilityTo restaurants and public transportationReport reviewResponse from the ownera month agoWe are so happy to hear this fantastic review Sefri Haryanto. It's great to hear that you were happy to stay with us on your first visit to London. Come back soon - Anna & The Novotel London Canary Wharf Family",5
1699100853-141,"Vacation ❘ FriendsDO NOT BOOK. TO AVOID. We stayed for 2 nights and we did not have hot water on the top floor. Let me rephrase: we did not even have water, as the pressure was so low that we could not even flush the toilet or brush our teeth. The … Read moreDO NOT BOOK. TO AVOID. We stayed for 2 nights and we did not have hot water on the top floor. Let me rephrase: we did not even have water, as the pressure was so low that we could not even flush the toilet or brush our teeth. The receptionist told us that this happens when the students on the second floor use all the water. We tried also during the night, we had to let the water run for 30 minutes to have lukewarm water, so basically we did not shower.
On the second day in the morning, we did not have water at all. In the night, we had hot water but while showering, it was being cut off and when it came back it became boiling, with no possibility to moderate it towards colder.
The staff of the morning shift was rude and unpleasant. The girl on the afternoon shift was helpful and we thank her for her help, however, her male colleague was scrolling on his phone and completely ignored us.
The funny thing is that in the reviews on Google, the property replies in the same way to all comments, which are basically a) rude staff and b) no water. One could assume that they would have fixed these two but they do not seem to care. Positive: The beds were comfortable, the location was safe and well-connected, and the room was quiet (top floor). We also had a kettle.Rooms2.0Service1.0Location5.0Hotel highlightsQuietReport reviewResponse from the ownera month agoHello, 
Thank you for taking your time to write us a review. We are sorry to read that our hostel/ your stay didn’t live up to your expectations. 
We will take your valuable feedback into account and hopefully, if you decide to stay again with us, you will notice all the positive improvements.",2
1699100853-142,"Vacation ❘ SoloIn general, I am satisfied. The price for London is favorable, it is convenient to get to the city center. Service is good, room is clean and quiet. Breakfast saves time and is quite good. … Read moreIn general, I am satisfied. The price for London is favorable, it is convenient to get to the city center. Service is good, room is clean and quiet. Breakfast saves time and is quite good.
Small space, more suitable for short people🤣.
Good budget hostel.Rooms4.0Service5.0Location5.0Hotel highlightsQuiet · Great valueReport reviewResponse from the owner2 months agoThank you for rating us so high. We are glad we exceeded your expectations. We hope to see you again soon. 
Kind regards, team HPV.",5
1699100853-143,"Vacation ❘ SoloI don't know what more someone could want. I booked a double and the check-in was easy, the people on the desk were friendly, the room was  a good size, the bed was comfortable, the shower had good pressure . . . It was the perfect place to … Read moreI don't know what more someone could want. I booked a double and the check-in was easy, the people on the desk were friendly, the room was  a good size, the bed was comfortable, the shower had good pressure . . . It was the perfect place to lay my head after Bruce Springsteen. And it's just a 15 minute walk through the park to the north entrance for BST Summertime. I know where I am staying next time!Rooms5.0Service5.0Location5.0Hotel highlightsGreat valueReport reviewResponse from the owner3 months agoHi there Thank you for your feedback. We are very glad to learn that you enjoyed your stay. Hope to see you back sometime soon! Good luck with the rest of your travels, HPV Team",5
1699100853-144,"Ich habe mich durchgerungen zwei statt einem Stern zu geben, da ich (in Bezug auf Einrichtung etc.) schon Schlimmeres erlebt habe. Die Sauberkeit fand ich okay und unser Bad war in Ordnung. Ich habe in einem 6er-Schlafsaal geschlafen bzw. … Read moreIch habe mich durchgerungen zwei statt einem Stern zu geben, da ich (in Bezug auf Einrichtung etc.) schon Schlimmeres erlebt habe. Die Sauberkeit fand ich okay und unser Bad war in Ordnung. Ich habe in einem 6er-Schlafsaal geschlafen bzw. habe versucht, zu schlafen. Und hier fängt die Misere auch schon an: Es war unfassbar warm im Zimmer (ca. 10 Grad mehr als draußen) und, was ich schlimmer fand, unendlich stickig. Ich hatte das oberste Bett und hatte das Gefühl, nicht atmen zu können. Ich bin tatsächlich mitten in der Nacht in ein anderes Hostel umgezogen, da Schlafen in diesem Zimmer unmöglich war. Ich bin eigentlich nicht zimperlich, aber so unfassbar schlechte Luft habe ich noch nie erlebt. Für die zweite Nacht wurde mir netterweise ein tieferes Bett zugeteilt. Hier konnte ich einigermaßen schlafen. Daher auch 2 Sterne für den Service statt einem. Ansonsten hat es die Angestellten nicht wirklich interessiert, was man für Probleme hat.
Da schon mehrere Leute die Probleme mit Luft und Wärme geschildert haben, verstehe ich nicht, warum sich das Hostel nicht darum bemüht, dass man wenigstens die Fenster weiter öffnen kann.
(Translated by Google)
I struggled to give two stars instead of one because I've experienced worse (in terms of furnishings etc.). I thought the cleanliness was okay and our bathroom was fine. I slept or tried to sleep in a 6-person dormitory. And this is where the misery begins: It was incredibly warm in the room (about 10 degrees more than outside) and, what I found worse, incredibly stuffy. I had the top bunk and felt like I couldn't breathe. I actually moved to another hostel in the middle of the night because sleeping in that room was impossible. I'm actually not squeamish, but I've never experienced such incredibly bad air. For the second night I was kindly given a deeper bed. I was able to get some sleep here. Hence 2 stars for the service instead of one. Otherwise, the employees weren't really interested in what problems you had.
Since several people have already described the problems with air and heat, I don't understand why the hostel doesn't make an effort to at least open the windows more.Rooms1.0Service2.0Location3.0Report reviewResponse from the ownera month agoHello, 
Thank you for taking your time to write us a review. We are sorry to read that our hostel/ your stay didn’t live up to your expectations. 
We will take your valuable feedback into account and hopefully, if you decide to stay again with us, you will notice all the positive improvements.",2
1699100853-145,"Vacation ❘ FriendsStayed at this hostel for half a week, they checked in at 2pm and checked out at 10 am. If you decide to arrive early to check in you can keep the luggage for free and freshen up but if you decide to check out and want to keep the luggage … Read moreStayed at this hostel for half a week, they checked in at 2pm and checked out at 10 am. If you decide to arrive early to check in you can keep the luggage for free and freshen up but if you decide to check out and want to keep the luggage they charge a fee of 3 pounds. They have around 6 beds in mixed gender dorms, and toilets are maintained clean. They give duvets and bedsheets. They have a kitchen where you can cook your own food or can buy breakfast for 6.5 pounds. The location is at a prime location and the Paddington station is at a 10 minute walk.Rooms4.0Service4.0Location5.0Hotel highlightsGreat valueReport reviewResponse from the owner2 months agoHello 
Thank you for taking your time to write us such a nice review. 
Please do not hesitate to follow our latest news and offers on our social networks. 
We hope we will see you again soon!
Kind Regards 
HPV team.",4
1699100853-146,"Overall, okay experience. They accommodated my group in one room. Room was small but clean. The kitchen is quite small and there’s not napkins and things to clean. … Read moreOverall, okay experience. They accommodated my group in one room. Room was small but clean. The kitchen is quite small and there’s not napkins and things to clean.
You have to make your bed yourself and bring the covers back to reception when you check out!! That’s a first! There is a socket in every bed and a usb port. Storage available in the room, under the beds.
Very good location, but you can hear everything from outside.
Check in is at 10am, not enough time in the morning.
I don’t know much of the rest if the facilities since the room had a private bathroom.
I wouldn’t book again, if I’m traveling by myself.Report reviewResponse from the owner4 months agoHello 
Thank you for taking your time to write us a review. 
Please do not hesitate to follow our latest news and offers on our social networks. 
Kind Regards 
HPV team.",3
1699100853-147,"Fantasticly located
Rooms are clean and having a private bathroom is very enjoyable
We didn't have breakfast but it looks like a great value … Read moreFantasticly located
Rooms are clean and having a private bathroom is very enjoyable
We didn't have breakfast but it looks like a great value
Very nice neighborhood
People at the reception were nice
we ll be backRooms5.0Service5.0Location5.0Report reviewResponse from the ownera week agoHello,
Thank you for taking your time to write us such a nice review and rating the hostel so high.
Thank you for choosing our hostel, and for taking the time to write such a lovely review! We are so glad to hear that you enjoyed our hospitality.....great customers like you make delivering exceptional customer service easy. Our hotel aims to provide a truly unique experience, and we are thrilled that we were able to exceed your expectations. Our goal is to ensure each guest gets an excellent customer service and our reception staff is highly trained in customer services. 
Please do not hesitate to follow our latest news and offers on our social networks. 
We enjoyed having you as much as you enjoyed staying with us.
We look forward to welcoming you back to our hotel in the future. 
Kind regards HPV Team.",5
1699100853-148,"Vacation ❘ SoloAvoid if disabled!!!
This hostel does not let you stay with government issued ID and the staff are … Read moreAvoid if disabled!!!
This hostel does not let you stay with government issued ID and the staff are rude and hostile then when you try to communicate they constantly talk over you and call you rude when you try to explain but they don’t want to listen. The hostel manager believes unless you sleep on their premises you can’t complain and the reception staff won’t deal with problems because they are just receptionists.
This hostel also ignores all paperwork presented so avoid staying here
Further to hostels response have tried to communicate with them again to be hung up on again if disabled please avoid!!!Rooms1.0Service1.0Location3.0Report reviewResponse from the owner2 months agoThank you for taking your time to write a review. We are sorry to read that our hostel/ your stay didn’t live up to your expectations. We would respectfully like to reply to your detailed review to ensure you that we take all our customers feedback seriously.
Customer satisfaction is at the heart of what we do and our incredible team lead by customer centric management continually ensure that we exceed expectation. If you view many of the other reviews on this site, hospitality and staff/customer service is one of the highest rated metrics alongside location. Could you have reviewed the wrong hostel by mistake? It sometimes happens that regular hostel stayers review the wrong hostel(s) by mistake. 
However if we do fail to meet customers expectations, we collectively as a team find solutions to ensure that failed performances are not repeated. 
Kind Regards from the Smart Hostels, Hyde Park View Team.",1
