1699100871-175,"Vacation ❘ SoloThe customer service here was not good. Not the worst I’ve seen but every single employee I dealt with seemed SO annoyed that they had to check me in or help with anything. Felt like that’s just how the whole establishment decided to treat … Read moreThe customer service here was not good. Not the worst I’ve seen but every single employee I dealt with seemed SO annoyed that they had to check me in or help with anything. Felt like that’s just how the whole establishment decided to treat people. No info on how the place works just here’s your key. Thin walls/noisy- bring headphones or ear plugs. The main reason I booked this one is because they have curtains on all the bunks! A must for me. Rooms are okay, no ventilation in ours. It was cold outside but hot stinky in the room. Mostly clean. They could use some better signage, it’s really hard to find if you come after holland park closes. (There’s a tiny, barely marked gate that’s the only way to get in) Breakfast is tiny with very few options for £8. They charge a “corkage fee” if you want to eat your own breakfast or snacks or drinks which is ridiculous considering their limited options. I’d suggest a hostel with a kitchen and less “nickel and dime-y”. I definitely wouldn’t stay again. Location is pretty great. 10 min walk to trains. Inside/Outside of 2 beautiful parks- one more recreational and one full of flowers and beauty. The hostel does feel safe (other than the walk to get there at night alone feels sketchy and secluded). They have key cards to access your building and your room. I appreciate that.Rooms3.0Service1.0Location4.0Report reviewResponse from the owner2 months agoDear Guest,Thank you for taking the time to share your feedback. While I wish you had a better experience, it is feedback like this that we learn from and use to improve. We work hard to deliver an exceptional guest experience, and it's apparent in this case that we fell short. If you give us a chance to earn back your trust, I can assure you that we will do our best to give you the great hotel experience that so many of our guests have grown so fond of.Sincerely,Alex",3
1699100871-176,"SoloGreat place to stay for location and vibe. Sheets on the bed were dirty, pillow was like a rock. When I arrived all the toilets were filthy, not all the doors locked and there was no toilet paper to be found. I would question when they were … Read moreGreat place to stay for location and vibe. Sheets on the bed were dirty, pillow was like a rock. When I arrived all the toilets were filthy, not all the doors locked and there was no toilet paper to be found. I would question when they were last clean from the state of them.
What makes this place great is its centrality affordability and the cool people staying there.
I can’t say much more about the amenities as I didn’t hang around long but in the morning the bathroom was still disguising however there was some toilet paper.
It’s a real shame as I would stay here again if it wasn’t for the cleanliness issues.Rooms1.0Service2.0Location5.0Report reviewResponse from the ownera month agoDear Guest,Thank you so much for your feedback regarding your recent stay with us. We are delighted that you enjoyed your stay and we hope to see you again in the near future.Kind RegardsAlex Badea General Manager Safestay Holland Park",3
1699100871-177,"This hostel is nestled inside Holland Park - which is a lovely small place.
The only reason I'm giving 3 stars for Location is that the walk to the metro is … Read moreThis hostel is nestled inside Holland Park - which is a lovely small place.
The only reason I'm giving 3 stars for Location is that the walk to the metro is a decent distance. Nothing unmanageable, but it is not as convenient as you might find elsewhere.
Bunks are comfy - and there are lockers in each room, though you will need a small padlock to lock them. Only ones of a specific size work, but if the ones you bring don't work they sell ones that do at the reception desk.Rooms4.0Service3.0Location3.0Report reviewResponse from the owner2 months agoDear Guest, Thank you so much for your review of our hostel. I am pleased to hear you enjoyed your stay with us. It's something our staff takes great pride in, so we value your feedback. We hope you will visit us again.   Kind Regards Alex Badea Safestay Holland Park",5
1699100871-178,"Vacation ❘ CoupleHostel that has private rooms or shared rooms. Had a private room. Comes with a safe and lock boxes in room. Bathroom had no hand soap though and the shower has a push button that must be held at all times to run the waterRooms4.0Service5.0Location5.0Hotel highlightsGreat valueReport reviewResponse from the ownera month agoDear Guest,Thank you so much for your feedback regarding your recent stay with us. We are delighted that you enjoyed your stay and we hope to see you again in the near future.Kind RegardsDoaaReception Safestay Holland Park",4
1699100871-179,"The private rooms are quite expensive for what they are and are just adequate. Clean, for one thing. The dormitory/hostel quarters may be well priced. Breakfast is poor, coffee undrinkable. The breakfast room, also available for work, etc., … Read moreThe private rooms are quite expensive for what they are and are just adequate. Clean, for one thing. The dormitory/hostel quarters may be well priced. Breakfast is poor, coffee undrinkable. The breakfast room, also available for work, etc., has TVs and annoying music on all the time.  But the location is beautiful. You can exit, turn right and enter Holland Park proper during the day.
It's easy to get confused trying to get there at night. From the Holland Park tube station, cross the street in front of you, turn left, cross the next street. After the first building, you will see Holland Walk on the right. Walk up the hill. After it levels off and veers left, watch for the Youth Hostel sign on the right and either use your key card to get in or press the button on the stainless steel box for reception to buzz you in.
For a better breakfast, try Boulangerie Paul a few storefronts to the left of the tube entrance.Rooms2.0Service2.0Location5.0Report reviewResponse from the owner2 months agoDear Guest,  Thank you for taking the time to share your feedback. I would like to start by apologizing to you for not meeting your expectations.  Again, thank you for sharing your comments, and if I can be of assistance to you, please contact me directly.  Sincerely,  Alex Badea  Safestay Holland Park",3
1699100871-180,"Vacation ❘ SoloThe location is beautiful, the building is nice.
This hostel had everything to be perfect BUT the place is the dirtiest I've ever stayed on, especially the bathrooms as they are only cleaned once a day at 10am … Read moreThe location is beautiful, the building is nice.
This hostel had everything to be perfect BUT the place is the dirtiest I've ever stayed on, especially the bathrooms as they are only cleaned once a day at 10am and the hostel is huge, so you can imagine.
Also, it feels like there's no management what so ever or if there is, they're very incompetent. On top of that, and although the staff is nice, they're not trained to deal with the public nor to work in hospitality.
Such a pity.Rooms1.0Service1.0Location3.0Report reviewResponse from the ownera month agoDear Guest,Thank you for taking the time to share your feedback. While I wish you had a better experience, it is feedback like this that we learn from and use to improve. We work hard to deliver an exceptional guest experience, and it's apparent in this case that we fell short. If you give us a chance to earn back your trust, I can assure you that we will do our best to give you the great hotel experience that so many of our guests have grown so fond of.Sincerely,",2
1699100877-181,"Besides the great location for connectivity on Elizabethan line, Heathrow express, trains and underground... the hotel can do a lot to improve. The staff are a very unfriendly bunch who has forgotten how to smile. I am made to feel I have … Read moreBesides the great location for connectivity on Elizabethan line, Heathrow express, trains and underground... the hotel can do a lot to improve. The staff are a very unfriendly bunch who has forgotten how to smile. I am made to feel I have interrupted their busy schedule when I am checking in and out.
The rooms are spacious and clean.
I stay in room 190.. the temperature control was not working and I had to spend the night with extra layers just to keep warm.Rooms3.0Service1.0Location5.0Report review",3
1699100877-182,"Business ❘ SoloFor a ""train station hotel"", this is not bad at all.  It's connected to Paddington Station so it's uber convenient. The room was nice and roomy while all the staff was super friendly and helpful. One thing I wish they'd do soon is to … Read moreFor a ""train station hotel"", this is not bad at all.  It's connected to Paddington Station so it's uber convenient. The room was nice and roomy while all the staff was super friendly and helpful. One thing I wish they'd do soon is to replace all shower curtains with shower door/glass.  That's probably the only negative feedback I have for them.Rooms5.0Service5.0Location5.0Hotel highlightsKid-friendly · Great valueReport review",5
1699100877-183,"Business ❘ SoloWas here for a business workshop on 19th Oct. Such a bad experience.
1. Workshop room thunderbolt not very well managed.
2. Limited availability of washroom where you have 5-6 meeting rooms in line. … Read moreWas here for a business workshop on 19th Oct. Such a bad experience.
1. Workshop room thunderbolt not very well managed.
2. Limited availability of washroom where you have 5-6 meeting rooms in line.
3. Dirty washrooms blocked sink
4. Choked toilets. Worst.
5. Less food options. Quality of food is good even on roadside. Pls pay good to chefs or replace them if you are paying well.
I would personally not recommend this for business activities.
ThanksService3.0Location4.0Report review",2
1699100877-184,"The hotel was a pleasant surprise. The staff was accommodating, the room was cozy, and the meals were delightful. Can't wait to revisit!Rooms4.0Service5.0Report review",4
1699100877-185,"Business ❘ FriendsVisited the Hilton London Paddington for a works meeting. The room that we used was vert well set-up. There was a good supply of coffee, teas and pastries and cakes in the morning and afternoon. Lunch time there was a good selection of hot … Read moreVisited the Hilton London Paddington for a works meeting. The room that we used was vert well set-up. There was a good supply of coffee, teas and pastries and cakes in the morning and afternoon. Lunch time there was a good selection of hot meals and a buffet with also various sweets and puddings. Overall it was a very good venue and we where well looked after.Rooms5.0Service5.0Location5.0Hotel highlightsLuxuryReport review",5
1699100877-186,"Vacation ❘ CoupleStayed for one night, room was ok but dated in areas and furniture and fittings very worn and in need of replacement. Some staff very helpful, others not really that interested in your query. Concierge was very good. Great location next to … Read moreStayed for one night, room was ok but dated in areas and furniture and fittings very worn and in need of replacement. Some staff very helpful, others not really that interested in your query. Concierge was very good. Great location next to the train/underground stations. Breakfast was good the next morning, very busy, but plenty to choose from.Rooms3.0Service4.0Location5.0Hotel highlightsGreat valueReport review",3
1699100877-187,"The place is iconic in terms of the location. But run down in all the other fronts. Not been in to the rooms but if the reception has lost it’s charm, one can only wonder!Report review",3
1699100877-188,"Vacation ❘ FamilyHad a really horrible experience including pests and slow/bad service from front desk. We had to change rooms at midnight due to the above and we had to fight with them for proper beds instead of roll on beds, there was a lot of repetition … Read moreHad a really horrible experience including pests and slow/bad service from front desk. We had to change rooms at midnight due to the above and we had to fight with them for proper beds instead of roll on beds, there was a lot of repetition as we were constantly directed to new people every day, and at the end of the day the rooms were old, dusty, and even smelly.Rooms2.0Service3.0Location5.0Report review",2
1699100877-189,"Business ❘ FriendsGreat old style and fashioned hotel in the core of London.
The old british style and flair of these hotel can be found as well in the old rooms. Some of the rooms need a renovation at some parts but thats quite normal … Read moreGreat old style and fashioned hotel in the core of London.
The old british style and flair of these hotel can be found as well in the old rooms. Some of the rooms need a renovation at some parts but thats quite normal for a hotel with this amount of guests. Service is modern und excellent, the guys really try to read your wishes from the eyes :)  i will get back here for sureRooms4.0Service4.0Location5.0Report review",4
1699100877-190,Business ❘ SoloNice former GWR Hotel very close to train station with good onward connections across London. There was noise outside my room window (trains or generator revving 24/7) enough to be annoying but not enough to go to the hassle of moving. Special mention to Ranesh at breakfast and Fatima at reception.Rooms4.0Service5.0Location5.0Report review,4
1699100883-191,Business ❘ SoloGreat location. Clean rooms. No plug sockets by the bed - big no no. Tv in room was very small. View was good and location was ideal for Boxpark and tube not to mention Wembley Stadium. Breakfast was decent but trying to have a drink in the … Read moreGreat location. Clean rooms. No plug sockets by the bed - big no no. Tv in room was very small. View was good and location was ideal for Boxpark and tube not to mention Wembley Stadium. Breakfast was decent but trying to have a drink in the evening was something to avoid. Staff serving taking as much time as possible and in no rush to serve the next person.  Could definitely improve in this area.Rooms3.0Service2.0Location5.0Hotel highlightsGreat valueReport review,3
1699100883-192,"Apparently ""Life is like a box of chocolates, you never know what you're going to get.” Unless you stay in a Premier Inn of course where everything is utterly predictable (and almost like Groundhog Day) … Read moreApparently ""Life is like a box of chocolates, you never know what you're going to get.” Unless you stay in a Premier Inn of course where everything is utterly predictable (and almost like Groundhog Day)
Big rooms, comfy beds and polite staff. Breakfast was good here too.
Only a 3 star in terms of quality though but you get what you pay for and this is much less than almost every other hotel in the area. Kettle and hairdryer a bit iffy in this one BTW.Report review",4
1699100883-193,"Business ❘ SoloHad stayed on the 4th floor and room was nice and clean great views staff was nice and friendly.
Bad bits water pressure was rubbish  no handle in the shower to grab to get om … Read moreHad stayed on the 4th floor and room was nice and clean great views staff was nice and friendly.
Bad bits water pressure was rubbish  no handle in the shower to grab to get om or out. Poor lightning  lack off sockets  around the bed.
Very very bad bits Site is not secured  and had the van broken into 2 twice and 4 others at the same time the barrier  isn't working so it's a free for all.
Would never stay their again due to the above.Rooms5.0Service5.0Location1.0Hotel highlightsGreat viewSafetysecurity  issues on site with contractors vehicles getting broken in to every niteReport review",1
1699100883-194,"Vacation ❘ FamilyOur family room was large, the beds were very comfortable and the view from the window was great. It was very clean, the people were very nice and we loved the breakfast! Also the location of the hotel in london was perfekt. The underground … Read moreOur family room was large, the beds were very comfortable and the view from the window was great. It was very clean, the people were very nice and we loved the breakfast! Also the location of the hotel in london was perfekt. The underground isn't far away and you can't get bored. All in all we really enjoyed the time and we have nothing to complain. It was the best hotel we could get for this price!Rooms5.0Service5.0Location5.0Hotel highlightsQuiet · Kid-friendly · Great valueRoomsVery clean and perfekt for me and my familyNearby activitiesYou can make a great and long walk around the hotel. You can take many photos and you have many stores and shops. Don't forget the wembley design Outlet and the Station that arn't far away.Food & drinksWe really enjoyed the breakfast in the hotel. The service was also great!Report review",5
1699100883-195,"Vacation ❘ SoloA great location for a Premier Inn. Just down the steps / lift at Wembley Park Station. Room was spacious and clean but a little let down by seemingly broken AC controls and a tiny and old TV in the room, otherwise was fine. Comfortable bed. Quiet too. In a 5G area too so great alternatives to the otherwise expensive WiFi options.Rooms5.0Service5.0Location5.0Hotel highlightsGreat view · Quiet · Great value …Read moreRoomsSpacious room and mostly modernised. Bathroom felt a little dated.Nearby activitiesLots of stuff going on at or near Wembley, food & drink, entertainment, shows and performances...WalkabilityCan access nearby locations via a ramp and lifts.Report review",5
1699100883-196,"We stayed here after a concert in Wembley and it was a great experience. We got a room on the Quiet floor and I would highly recommend it - definitely one of the quieter hotels I've stayed at. The check-in process was swift, and the receptionist Rupesh was very friendly and welcoming.Rooms5.0Service5.0Location5.0Report review",5
1699100883-197,"Vacation ❘ CoupleThe room was never cleaned and washed every day, obviously you had to go down to reception to report it. There was no minibar or water in the room. … Read moreThe room was never cleaned and washed every day, obviously you had to go down to reception to report it. There was no minibar or water in the room.
The building is very old - especially the lobby around the entrance and reception. The service was nothing to brag about. The hotel is next to Wembley Park station which is super ideal for people using the tube. I would not have stayed there again, very old hotel and not the best service.Rooms1.0Service1.0Location5.0Report review",2
1699100883-198,Vacation ❘ FamilyThe rooms were very clean and big. Very near to Wembley park station.The staff were very friendly. Especially praba and jacintha were very nice. Would definitely stay againRooms5.0Service5.0Location5.0Hotel highlightsGreat view · Quiet · Kid-friendly · Great valueReport review,5
1699100883-199,"Vacation ❘ FamilyGreat location 10 min walk from Wembley arena and London designer outlet.
Rooms Great for chilling ,sleeping.
Plenty around convenient for everything
Will definitely be backRooms5.0Service5.0Location5.0Hotel highlightsQuiet · Kid-friendly · Great value …Read moreNearby activitiesWembely arena and London designer outlet 10 min walk
Plenty of resraunts fast food , convenience storesWalkability10 min walk to arena and shopping center
Train Station right next to hotelNoteworthy detailsPlenty of prebookable parking on just park at great pricesReport review",5
1699100883-200,"Every single member of staff I came across was really friendly and helpful, which gives the place a good atmosphere. Thanks to all of them for making it such a nice stay.Rooms5.0Service5.0Location5.0Report review",5
1699100888-201,"Before I start, I think this hotel is amazing. The service was lovely and the location was awesome (next door to The O2). However........2 things which I didn't enjoy. 1) the room/corridor doors banged every time they were shut. People were … Read moreBefore I start, I think this hotel is amazing. The service was lovely and the location was awesome (next door to The O2). However........2 things which I didn't enjoy. 1) the room/corridor doors banged every time they were shut. People were returning all night which meant the doors were banging all night. 2) the pillows were far too soft. They took up so much space but had nothing too them. It was like I was being smothered. Apart from that, absolutely amazingRooms3.0Service5.0Location5.0Report review",4
1699100888-202,"Vacation ❘ CoupleThe hotel itself was incredible and the room was fantastic. The pillows were to die for. The location right next to The O2 is so convenient, not only for events there but also for the shops, restaurants and other entertainment. There’s just … Read moreThe hotel itself was incredible and the room was fantastic. The pillows were to die for. The location right next to The O2 is so convenient, not only for events there but also for the shops, restaurants and other entertainment. There’s just so much in there.
Although the receptionist was very nice and attentive, I was a bit underwhelmed by the service in the hotel bars. My partner wasn’t made to feel welcome and was made to feel embarrassed so quickly left. I was also disappointed with the quality of room service - specifically the pizza. For a high end hotel I expected far better quality food.
I would certainly stay here again, but would hope that we got luckier with the staff on shift if we were to visit the bars.Rooms5.0Service3.0Location5.0Hotel highlightsLuxury · Great view · High-techReport review",4
1699100888-203,"This hotel is superb choice for a great stay in London. They have delightful views of Canary Wharf and the River Thames. All that you need is a quick taxi ride into Greenwich to enjoy the London experience with countless restaurants, pubs … Read moreThis hotel is superb choice for a great stay in London. They have delightful views of Canary Wharf and the River Thames. All that you need is a quick taxi ride into Greenwich to enjoy the London experience with countless restaurants, pubs and shops. The staff is very hospitable. They even received us with a bottle of champagne and delectable macaroons. Afternoon tea at the 1st floor restaurant is A MUST. The full breakfast buffet is my personal suggestion…
you will get your money’s worth. Five stars is not enough to rate the experience. The only downfall is that the jacuzzi wasn’t really hot, but despite the fact, our experience was lovely. Thank you, Intercontinental!Report review",5
1699100888-204,"Stayed here midweek. - would recommend this as it’s quiet!
Staff were super friendly. … Read moreStayed here midweek. - would recommend this as it’s quiet!
Staff were super friendly.
Decor was beautiful in the lobby.
The spa was empty, pool area was clean! They have a steam room which was lovely.
Ordered breakfast in bed and had a beautiful view of our city!
Would definitely come back here again!Rooms5.0Service5.0Location5.0Report review",5
1699100888-205,"Business ❘ CoupleRecently stayed here for work and loved this hotel. We stayed in the apartment style rooms and it was great, really big room overlooking the river with everything you need if you did want to cook something. Breakfast was also amazing, lots … Read moreRecently stayed here for work and loved this hotel. We stayed in the apartment style rooms and it was great, really big room overlooking the river with everything you need if you did want to cook something. Breakfast was also amazing, lots of choice and very tasty. It was included with our booking but one of the best we’ve ever experienced. Staff were also super friendly and helpful.Rooms5.0Service5.0Location5.0Hotel highlightsLuxury · Great viewReport review",5
1699100888-206,"Vacation ❘ CoupleNice modern hotel.
Upscale feel to this reasonably priced hotel. … Read moreNice modern hotel.
Upscale feel to this reasonably priced hotel.
Club lounge food and drink very good with a nice range of self pour spirits.
Excellent spa - jacuzzi, nice sized pool, sauna, steam room and comfortable loungers. Very well equipped changing rooms with swim suit ringers and complimentary fruit infused water.
Well equipped gym with complimentary water and fruit.
Excellent restaurant (reviewed separately).
Well equipped rooms - some with excellent river views.
8.5/10 would recommendRooms5.0Service5.0Location5.0Hotel highlightsLuxury · Great view · Romantic · High-techReport review",5
1699100888-207,"This is one of the best all around hotels I have ever stayed at. From the moment we stepped into the hotel we were seen to with a warm and friendly smile. They were so welcoming at all the various desks and services. … Read moreThis is one of the best all around hotels I have ever stayed at. From the moment we stepped into the hotel we were seen to with a warm and friendly smile. They were so welcoming at all the various desks and services.
The room was beautiful very clean and comfortable.
Being a kosher consumer they took care at breakfast to make sure I had what to eat.
Anytime we had a request they were there within 5-10 minutes and being a very large hotel that is very impressive.
This hotel is adjacent to the O2 arena which has loads of shopping and activities.
It’s a bit out of the downtown area as this is in canary wharf however I would stay here again in a heartbeat as the Tube is within 4 min walking distance. Two thumbs way up!!!Rooms5.0Service5.0Location4.0Report review+11",5
